505,Miso Robotics,"Pasadena, California, United States",Active,For Profit,,,,,,9.0,"Artificial Intelligence, Consumer Electronics, Data and Analytics, Hardware, Science and Engineering, Software","Artificial Intelligence, Consumer Electronics, Machine Learning, Robotics",9.0,Seed,2021-12-14,541872.0,USD,541872.0,Seed,Seed,541872.0,USD,541872.0,79299425.0,USD,79299425.0,,16.077,"32,535.83",15.0,,,,"Crowdcube, SeedInvest, Meyer Global Management, Knockout Capital, Acacia Research"
506,Bizongo,"Mumbai, Maharashtra, India",Active,For Profit,,,,,10.0,20.0,"Administrative Services, Commerce and Shopping, Other","B2B, E-Commerce, Marketplace, Packaging Services",10.0,Late Stage Venture,2021-12-06,110000000.0,USD,110000000.0,Series D,Series D,110000000.0,USD,110000000.0,240314603.0,USD,240314603.0,,27.924,"33,303.17",638.0,,,,"IDG Capital, B Capital Group, Tiger Global Management, Accel, International Finance Corporation"
507,3i Inc.,"Seoul, Seoul-t'ukpyolsi, South Korea",Active,For Profit,,,,,2.0,12.0,"Consumer Electronics, Hardware, Software","Computer Vision, Electronics, Software",5.0,Early Stage Venture,2021-09-23,24000000.0,USD,24000000.0,Series A,Series A,24000000.0,USD,24000000.0,27500000.0,USD,27500000.0,,5.028,"3,410.83",0.0,,,,"YG Entertainment, SAP.iO, Korea Development Bank, DS Asset Management, LB Investment"
508,SiFive,"San Mateo, California, United States",Active,For Profit,,,,,6.0,16.0,"Consumer Electronics, Hardware, Manufacturing, Science and Engineering","Electronics, Manufacturing, Semiconductor, Wearables",6.0,Late Stage Venture,2022-03-16,175000000.0,USD,175000000.0,Series F,Series F,175000000.0,USD,175000000.0,365500000.0,USD,365500000.0,3.0,45.64,"28,447.33",163.0,,,,"Spark Capital, Qualcomm Ventures, Coatue, Khaira Capital, Samsung Ventures"
509,Notarize,"Boston, Massachusetts, United States",Active,For Profit,,,,,5.0,19.0,"Professional Services, Software","Legal, Legal Tech, Software",9.0,Late Stage Venture,2022-03-27,,,,Secondary Market,Series D,130000000.0,USD,130000000.0,213337968.0,USD,213337968.0,,716.221,"822,575.83",875.0,,,,"Wells Fargo, Fifth Wall, Jon Oringer, Realogy Holdings, Lennar Corporation"
510,True.,"London, England, United Kingdom",Active,,62.0,10.0,6.0,3.0,,,"Financial Services, Lending and Investments","Finance, Financial Services, Venture Capital",1.0,,2017-12-14,6500000.0,GBP,8731242.0,Venture - Series Unknown,Venture - Series Unknown,6500000.0,GBP,8731242.0,6500000.0,GBP,8731243.0,,432,,0.0,2077.0,USD,2077.0,
511,Hard Yaka,"Crystal Bay, Nevada, United States",Active,,93.0,5.0,23.0,22.0,,,"Financial Services, Information Technology, Payments, Privacy and Security","Identity Management, Payments",,,,,,,,,,,,,,,,5.044,"3,509.17",9.0,,,,
512,Gauss Ventures,"London, England, United Kingdom",Active,,15.0,7.0,,,,,"Financial Services, Professional Services","Business Development, Finance, Financial Services",,,,,,,,,,,,,,,,2.505,,0.0,,,,
513,ICONIQ Growth,"San Francisco, California, United States",Active,,45.0,22.0,6.0,2.0,,,"Financial Services, Lending and Investments, Professional Services","Business Development, Finance, Financial Services, FinTech, Venture Capital",,,,,,,,,,,,,,,,16.011,"9,671.33",6.0,,,,
514,Kerala Ventures,"Paris, Ile-de-France, France",Active,,22.0,11.0,,,,,"Financial Services, Lending and Investments, Mobile, Software","Financial Services, Mobile, SaaS, Venture Capital",,,,,,,,,,,,,,,,,,,,,,
515,Bread and Butter Ventures (fka The Syndicate Fund),"Saint Paul, Minnesota, United States",Active,,58.0,8.0,28.0,1.0,,,"Agriculture and Farming, Commerce and Shopping, Food and Beverage, Hardware, Science and Engineering, Software, Transportation","AgTech, Food and Beverage, Retail Technology, Robotics, Supply Chain Management",,,,,,,,,,,,,,,,4.884,"1,316.17",162.0,,,,
516,EQT Ventures,"Stockholm, Stockholms Lan, Sweden",Active,,147.0,92.0,1.0,11.0,,,"Financial Services, Lending and Investments","Finance, Impact Investing, Venture Capital",,,,,,,,,,,,,,,7.0,6.182,"5,872.5",3.0,,,,
517,Alameda Research,"Central and Western, Hong Kong Island, Hong Kong",Active,For Profit,158.0,27.0,3.0,2.0,,,"Financial Services, Payments, Professional Services, Software","Business Development, Cryptocurrency, Financial Services",,,,,,,,,,,,,,,,43.922,"45,276.67",125.0,,,,
518,ada,"Kuala Lumpur, Kuala Lumpur, Malaysia",Active,For Profit,,,,,2.0,2.0,"Advertising, Sales and Marketing","Advertising, Marketing",2.0,,2021-05-11,60000000.0,USD,60000000.0,Corporate Round,Corporate Round,60000000.0,USD,60000000.0,80000000.0,USD,80000000.0,,20.873,"12,675.83",208.0,,,,"SoftBank, Sumitomo Corporation"
519,Fearless Fund,"Atlanta, Georgia, United States",Active,,13.0,4.0,11.0,,,,"Financial Services, Lending and Investments","Finance, Financial Exchanges, Financial Services",,,,,,,,,,,,,,,,42.207,"23,288.67",285.0,,,,
520,Phil,"San Francisco, California, United States",Active,For Profit,,,,,5.0,18.0,"Biotechnology, Science and Engineering, Software","Biotechnology, Software",6.0,Late Stage Venture,2021-06-03,56000000.0,USD,56000000.0,Series D,Series D,56000000.0,USD,56000000.0,121605000.0,USD,121605000.0,,603.116,"112,257.67",76.0,,,,"Warburg Pincus, Crosslink Capital, Silicon Valley Bank, Proton Enterprises, Eniac Ventures"
521,Airtel,"New Delhi, Delhi, India",Active,For Profit,15.0,9.0,,2.0,3.0,11.0,"Hardware, Mobile, Sales and Marketing","Mobile, Public Relations, Telecommunications",7.0,IPO,2022-01-28,700000000.0,USD,700000000.0,Post-IPO Equity,Post-IPO Equity,700000000.0,USD,700000000.0,4420819483.0,USD,4420819483.0,3.0,"17,703,245","16,650,994.83",300.0,,,,"Warburg Pincus, Google, Fidelity, BlackRock, Goldman Sachs Asset Management"
522,Gig Wage,"Dallas, Texas, United States",Active,For Profit,,,,,6.0,12.0,"Administrative Services, Financial Services, Health Care, Payments, Software","Employee Benefits, Financial Services, FinTech, Human Resources, Payments, SaaS",7.0,Early Stage Venture,2021-07-10,3250000.0,USD,3250000.0,Debt Financing,Series A,2500000.0,USD,2500000.0,16470000.0,USD,16470000.0,,373.786,79.049,1.091,,,,"Techstars, MassChallenge, Silicon Valley Bank, Revolution, Green Dot"
523,Accenture Ventures,"San Francisco, California, United States",Active,,26.0,11.0,3.0,,,,,,,,,,,,,,,,,,,,,,,,,,,
524,Capital on Tap,"London, England, United Kingdom",Active,For Profit,,,,,1.0,8.0,"Financial Services, Lending and Investments","Financial Services, FinTech, Venture Capital",4.0,Private Equity,2022-04-12,200000000.0,USD,200000000.0,Private Equity,Private Equity,200000000.0,USD,200000000.0,1092162194.0,USD,1092162194.0,,397.542,261.714,320.0,12897166.0,USD,12897166.0,"HSBC, TriplePoint Venture Growth, BNP Paribas, Citibank, Pollen Street Capital"
525,AiFi,"Santa Clara, California, United States",Active,For Profit,,,,,3.0,24.0,"Artificial Intelligence, Commerce and Shopping, Data and Analytics, Hardware, Science and Engineering, Software","Artificial Intelligence, Computer Vision, Retail Technology, Shopping, Software",4.0,Early Stage Venture,2022-03-11,65000000.0,USD,65000000.0,Series B,Series B,65000000.0,USD,65000000.0,80400000.0,USD,80400000.0,,13.378,10.012,122.0,,,,"Greylock, Qualcomm Ventures, Khaira Capital, Zabka Polska, StartX (Stanford-StartX Fund)"
526,Fulcrum Equity Partners,"Atlanta, Georgia, United States",Active,,64.0,55.0,8.0,18.0,,,"Health Care, Information Technology, Software","Enterprise Software, Health Care, Information Technology, SaaS",,,,,,,,,,,,,,,,7.473,4.184,8.0,77262.0,USD,77262.0,
527,Streamlit,"San Francisco, California, United States",Active,For Profit,,,,,3.0,9.0,"Artificial Intelligence, Data and Analytics, Science and Engineering, Software","Analytics, Artificial Intelligence, Big Data, Developer Tools, Machine Learning, Software",3.0,M&A,2021-04-07,35000000.0,USD,35000000.0,Series B,Series B,35000000.0,USD,35000000.0,62000000.0,USD,62000000.0,,676.14,623.707,688.0,,,,"Sequoia Capital, Elad Gil, Gradient Ventures, GGV Capital, Bloomberg Beta"
528,Touchdown Ventures,"Haddonfield, New Jersey, United States",Active,,62.0,,9.0,12.0,,,"Financial Services, Lending and Investments","Finance, Financial Services, Venture Capital",,,,,,,,,,,,,,,,9.602,6.498,305.0,,,,
529,Accel-KKR,"Menlo Park, California, United States",Active,,104.0,46.0,3.0,53.0,1.0,1.0,"Financial Services, Lending and Investments","Angel Investment, Finance, Venture Capital",1.0,,2017-05-02,,,,Venture - Series Unknown,Venture - Series Unknown,,,,,,,,32.44,"18,662.33",358.0,58920.0,USD,58920.0,Goldman Sachs Asset Management
530,Tile,"San Mateo, California, United States",Active,For Profit,,,,,4.0,24.0,"Apps, Consumer Electronics, Hardware, Internet Services, Mobile, Software","Apps, Consumer Electronics, Internet of Things, Mobile",6.0,M&A,2021-09-16,40000000.0,USD,40000000.0,Debt Financing,Series C,45000000.0,USD,45000000.0,141000000.0,USD,141000000.0,2.0,959.399,"878,637.33",222.0,62478.0,USD,62478.0,"Tencent, Francisco Partners, Slow Ventures, Bessemer Venture Partners, Khosla Ventures"
531,monday.com,"Tel Aviv, Tel Aviv, Israel",Active,For Profit,,,,,7.0,12.0,"Administrative Services, Other, Software","Collaboration, Project Management, SaaS, Task Management",8.0,IPO,2021-06-10,150000000.0,USD,150000000.0,Post-IPO Equity,Post-IPO Equity,150000000.0,USD,150000000.0,384100000.0,USD,384100000.0,1.0,"11,465,767","9,955,068",995.0,,,,"Zoom, Insight Partners, Stripes, Hamilton Lane, HarbourVest Partners"
532,Japan Post Holdings,"Tokyo, Tokyo, Japan",Active,For Profit,1.0,1.0,,1.0,,,"Financial Services, Lending and Investments","Banking, Finance, Insurance",,IPO,,,,,,,,,,,,,,"56,763,701","36,613,002.5",548.0,,,,
533,Trinity Ventures,"Menlo Park, California, United States",Active,,465.0,129.0,67.0,139.0,,,"Financial Services, Lending and Investments","Finance, Venture Capital",,,,,,,,,,,,,,,,3.974,"2,336.5",2.266,83393.0,USD,83393.0,
534,New York Life Insurance,"New York, New York, United States",Active,For Profit,19.0,5.0,5.0,9.0,,,Financial Services,"Finance, Financial Services, Insurance",,,,,,,,,,,,,,,2.0,"1,741,228","2,004,301.17",815.0,1626262927.0,USD,1626262927.0,
535,Griffin Gaming Partners,"Los Angeles, San Luis Potosi, Mexico",Active,,31.0,11.0,,3.0,,,"Financial Services, Gaming","Finance, Financial Services, Gaming",,,,,,,,,,,,,,,,10.796,"5,888.5",623.0,,,,
536,Trilogy Equity Partners,"Bellevue, Washington, United States",Active,,91.0,34.0,13.0,23.0,,,"Financial Services, Software","Enterprise Software, Finance, Financial Services",,,,,,,,,,,,,,,,17.025,,215.0,,,,
537,HubSpot,"Cambridge, Massachusetts, United States",Active,For Profit,14.0,1.0,1.0,5.0,3.0,12.0,"Data and Analytics, Internet Services, Media and Entertainment, Sales and Marketing, Software","Analytics, Marketing, SaaS, Social Media",6.0,IPO,2012-11-05,35000000.0,USD,35000000.0,Series E,Series E,35000000.0,USD,35000000.0,100500000.0,USD,100500000.0,38.0,"58,803,954","46,101,632.83",1.182,,,,"Sequoia Capital, General Catalyst, GV, Matrix Partners, Scale Venture Partners"
538,International Finance Corporation,"Washington, District of Columbia, United States",Active,,311.0,159.0,10.0,65.0,,,"Financial Services, Lending and Investments","Finance, Financial Services, Funding Platform, Hedge Funds",,,,,,,,,,,,,,,9.0,378.756,304.632,342.0,24702899.0,USD,24702899.0,
539,Instaclustr,"Redwood City, California, United States",Active,For Profit,,,,,4.0,7.0,"Data and Analytics, Education, Information Technology, Internet Services, Software","Analytics, Big Data, Cloud Data Services, Developer Platform, EdTech, Enterprise Software, Internet of Things, Software",4.0,M&A,2018-08-16,15000000.0,USD,15000000.0,Private Equity,Private Equity,15000000.0,USD,15000000.0,22164432.0,USD,22164432.0,5.0,77.359,"82,408.67",612.0,,,,"Artesian VC, Level Equity Management, Our Innovation Fund, Sydney Angels, Bailador"
540,Gro Intelligence,"New York, New York, United States",Active,For Profit,,,,,4.0,11.0,"Agriculture and Farming, Artificial Intelligence, Data and Analytics, Design, Information Technology, Science and Engineering, Software","Agriculture, Artificial Intelligence, Big Data, Data Visualization, Information Technology, SaaS",5.0,Early Stage Venture,2021-01-08,85000000.0,USD,85000000.0,Series B,Series B,85000000.0,USD,85000000.0,115309000.0,USD,115309000.0,,75.851,27.679,363.0,,,,"DCVC, GGV Capital, Intel Capital, Bossa Nova Investimentos, One Planet Group"
541,Forge,"San Francisco, California, United States",Active,For Profit,,,,,6.0,31.0,"Commerce and Shopping, Financial Services, Lending and Investments","Finance, Financial Services, FinTech, Marketplace, Trading Platform",8.0,IPO,2021-05-04,150000000.0,USD,150000000.0,Venture - Series Unknown,Venture - Series Unknown,150000000.0,USD,150000000.0,238500000.0,USD,238500000.0,2.0,221.08,"307,648.5",287.0,2402594.0,USD,2402594.0,"Draper Associates, Temasek Holdings, Deutsche Borse, Streamlined Ventures, Panorama Point Partners"
542,Elephant,"Boston, Massachusetts, United States",Active,,32.0,20.0,4.0,4.0,,,"Financial Services, Lending and Investments","Finance, Financial Services, Venture Capital",,,,,,,,,,,,,,,,5.301,,12.0,,,,
543,Humana,"Louisville, Kentucky, United States",Active,For Profit,16.0,4.0,2.0,4.0,,,"Financial Services, Health Care, Lending and Investments","Health Care, Health Insurance, Insurance, Venture Capital",1.0,IPO,2022-03-23,750000000.0,USD,750000000.0,Post-IPO Debt,,,,,750000000.0,USD,750000000.0,3.0,"6,313,215","6,096,969.83",639.0,,,,
544,Alive Ventures,"Los Angeles, California, United States",Active,For Profit,2.0,1.0,,,1.0,1.0,,,1.0,,2020-08-05,12000000.0,USD,12000000.0,Venture - Series Unknown,Venture - Series Unknown,12000000.0,USD,12000000.0,12000000.0,USD,12000000.0,,,,,,,,The SCAN Foundation
545,WuXi AppTec,"Shanghai, Shanghai, China",Active,For Profit,41.0,6.0,5.0,7.0,1.0,5.0,"Biotechnology, Health Care, Professional Services, Science and Engineering","Biotechnology, Health Care, Medical Device, Outsourcing, Pharmaceutical",6.0,IPO,2016-03-06,1500000000.0,USD,1500000000.0,Debt Financing,Post-IPO Equity,63000000.0,USD,63000000.0,1593470000.0,USD,1593470000.0,2.0,44.962,"65,689.33",180.0,,,,"Warburg Pincus, NewSpring, Eight Roads Ventures, Ping An Bank, Commerce Health Capital"
546,Sorenson Capital,"Lehi, Utah, United States",Active,,71.0,37.0,4.0,25.0,,,"Financial Services, Lending and Investments","Financial Services, Venture Capital",,,,,,,,,,,,,,,1.0,,,,,,,
547,VilCap Investments,"San Francisco, California, United States",Active,,86.0,3.0,30.0,7.0,,,"Agriculture and Farming, Education, Energy, Financial Services, Health Care, Sustainability","Agriculture, Clean Energy, Education, Finance, Health Care",,,,,,,,,,,,,,,,,,,,,,
548,United Ventures,"Milan, Lombardia, Italy",Active,,42.0,21.0,,5.0,,,"Financial Services, Software","Enterprise Software, FinTech",,,,,,,,,,,,,,,,1.892,"1,381.5",11.0,,,,
549,Sedgwick Claims Management Services,"Memphis, Tennessee, United States",Active,For Profit,4.0,2.0,,,1.0,2.0,"Financial Services, Lending and Investments, Professional Services","Banking, Insurance, Risk Management",3.0,M&A,2018-12-01,,,,Private Equity,Private Equity,,,,501781043.0,USD,501781043.0,1.0,"1,157,610",475.878,628.0,227923655.0,USD,227923655.0,"Caisse de Depot et Placement du Quebec, Canada Pension Plan Investment Board"
550,54gene,"Washington, District of Columbia, United States",Active,For Profit,,,,,3.0,23.0,"Biotechnology, Health Care, Science and Engineering","Biotechnology, Genetics, Health Care, Life Science",9.0,Early Stage Venture,2021-09-16,25000000.0,USD,25000000.0,Series B,Series B,25000000.0,USD,25000000.0,44725000.0,USD,44725000.0,,34.791,"17,689.5",858.0,,,,"Y Combinator, Bienville Capital, Fifty Years, Hack VC, Cathay Innovation"
551,Pantheon,"San Francisco, California, United States",Active,For Profit,,,,,4.0,16.0,"Hardware, Internet Services, Other, Software","Cloud Infrastructure, Enterprise Software, Infrastructure, SaaS, Web Development",7.0,Late Stage Venture,2021-07-13,100000000.0,USD,100000000.0,Series E,Series E,100000000.0,USD,100000000.0,200000000.0,USD,200000000.0,28.0,457.646,"507,356.67",519.0,942401.0,USD,942401.0,"SoftBank Vision Fund, Founder Collective, Scale Venture Partners, Foundry Group, Floodgate"
552,DHVC,"Palo Alto, California, United States",Active,,188.0,26.0,19.0,25.0,,,"Financial Services, Lending and Investments","Finance, Financial Services, Venture Capital",,,,,,,,,,,,,,,4.0,1.618,2.257,0.0,,,,
553,D-ID,"Tel Aviv, Tel Aviv, Israel",Active,For Profit,,,,,3.0,16.0,"Artificial Intelligence, Data and Analytics, Hardware, Media and Entertainment, Privacy and Security, Science and Engineering, Software","Artificial Intelligence, Computer Vision, Facial Recognition, Media and Entertainment, Privacy",5.0,Early Stage Venture,2022-03-22,25000000.0,USD,25000000.0,Series B,Series B,25000000.0,USD,25000000.0,47881868.0,USD,47881868.0,6.0,40.825,"15,320.67",114.0,,,,"Y Combinator, OurCrowd, AXA Venture Partners, Maverick Ventures, Pitango Venture Capital"
554,Triodos Investment Management,"Zeist, Utrecht, The Netherlands",Active,,24.0,14.0,,,,,"Financial Services, Lending and Investments",Banking,,,,,,,,,,,,,,,1.0,18.963,"67,301.33",30.0,,,,
555,Insider,"Singapore, Central Region, Singapore",Active,For Profit,,,,,6.0,12.0,"Artificial Intelligence, Data and Analytics, Sales and Marketing, Science and Engineering, Software","Analytics, Artificial Intelligence, Digital Marketing, Lead Management, SaaS",7.0,Late Stage Venture,2022-02-28,121000000.0,USD,121000000.0,Series D,Series D,121000000.0,USD,121000000.0,167100000.0,USD,167100000.0,1.0,"5,067,246","5,710,013.17",561.0,,,,"Sequoia Capital, 500 Startups, Sequoia Capital India, Endeavor Catalyst, Wamda Capital"
556,Weglot,"Paris, Ile-de-France, France",Active,For Profit,,,,,2.0,2.0,"Internet Services, Professional Services, Software","Developer APIs, Internet, Translation Service, Web Development",2.0,Early Stage Venture,2022-03-24,45000000.0,EUR,49538521.0,Series A,Series A,45000000.0,EUR,49538521.0,45450000.0,EUR,50033386.0,2.0,"1,678,641","484,757.17",1.055,,,,"Partech, SIDE Capital"
557,Sofina,"Brussels, Brussels Hoofdstedelijk Gewest, Belgium",Active,For Profit,74.0,27.0,,10.0,,,Financial Services,"Finance, Financial Services, FinTech",,IPO,,,,,,,,,,,,,1.0,33.115,"17,245.33",45.0,,,,
558,Balderton Capital,"London, England, United Kingdom",Active,,374.0,152.0,14.0,73.0,,,"Financial Services, Lending and Investments","Finance, Financial Services, Venture Capital",,,,,,,,,,,,,,,5.0,19.111,"12,191.33",280.0,,,,
559,Groupon,"Chicago, Illinois, United States",Active,For Profit,8.0,3.0,,1.0,5.0,24.0,"Commerce and Shopping, Internet Services, Media and Entertainment","E-Commerce, Internet, Retail, Social Media",8.0,IPO,2019-12-30,,,,Post-IPO Equity,Post-IPO Equity,,,,1387000000.0,USD,1387000000.0,19.0,"44,654,303","38,645,473",396.0,109322578.0,USD,109322578.0,"Silver Lake, Andreessen Horowitz, Greylock, Fidelity, Accel"
560,Preply,"Brookline, Massachusetts, United States",Active,For Profit,,,,,9.0,31.0,"Education, Software","E-Learning, EdTech, Education, Tutoring",9.0,Late Stage Venture,2022-03-30,49450983.0,USD,49450983.0,Series C,Series C,49450983.0,USD,49450983.0,100087289.0,USD,100087289.0,2.0,"10,930,693","7,831,938.33",1.224,1221059.0,USD,1221059.0,"Techstars, The Family, Hoxton Ventures, One Way Ventures, All Iron Ventures"
561,Endeavour Vision,"Geneva, Geneve, Switzerland",Active,,58.0,17.0,4.0,16.0,,,"Health Care, Mobile","Health Care, Medical, Medical Device, mHealth",,,,,,,,,,,,,,,,2.916,,0.0,,,,
562,Grover,"Berlin, Berlin, Germany",Active,For Profit,,,,,8.0,25.0,"Commerce and Shopping, Consumer Electronics, Hardware, Other","Consumer Electronics, E-Commerce, Rental, Subscription Service",16.0,Late Stage Venture,2022-04-07,220000000.0,USD,220000000.0,Debt Financing,Series C,110000000.0,USD,110000000.0,1999121428.0,USD,1999121428.0,5.0,"3,379,933","2,860,181.33",561.0,11040091.0,USD,11040091.0,"Seedcamp, Global Founders Capital, Augmentum Fintech, LG Group, Energy Impact Partners"
563,PropertyGuru Group,"Singapore, Central Region, Singapore",Active,For Profit,,,,,6.0,13.0,"Apps, Commerce and Shopping, Internet Services, Mobile, Real Estate, Software","E-Commerce, Mobile Apps, Online Portals, Real Estate, Rental Property",7.0,IPO,2022-03-18,132000000.0,USD,132000000.0,Post-IPO Equity,Post-IPO Equity,132000000.0,USD,132000000.0,676443674.0,USD,676443674.0,,22.9,"13,252.83",114.0,,,,"REA Group, Baillie Gifford, TPG, Emtek Group, Kohlberg Kravis Roberts"
564,Pocket FM,"Bengaluru, Karnataka, India",Active,For Profit,,,,,6.0,10.0,"Apps, Information Technology, Media and Entertainment, Music and Audio, Software","Apps, Digital Entertainment, Information Technology, Podcast, Software",5.0,Late Stage Venture,2022-03-03,4920000000.0,INR,64833198.0,Series C,Series C,4920000000.0,INR,64833198.0,93516015.0,USD,93516015.0,,14.461,"11,290.5",68.0,,,,"Tencent, Naver, Goodwater Capital, Lightspeed Venture Partners, Times Internet"
565,Inflection Point Ventures,"Gurgaon, Haryana, India",Active,,107.0,74.0,,3.0,,,"Financial Services, Lending and Investments, Professional Services","Business Development, Financial Services, Venture Capital",,,,,,,,,,,,,,,38.0,10.815,"10,654.17",96.0,,,,
566,InterWest Partners,"Menlo Park, California, United States",Active,,425.0,95.0,56.0,121.0,,,"Financial Services, Lending and Investments","Finance, Venture Capital",,,,,,,,,,,,,,,,,,,1039566.0,USD,1039566.0,
567,Plan B Media,"Bangkok, Krung Thep, Thailand",Active,For Profit,1.0,,,,1.0,1.0,"Advertising, Media and Entertainment, Sales and Marketing, Sports","Advertising, Digital Media, Outdoors",1.0,IPO,2014-04-03,300000.0,GBP,497886.0,Venture - Series Unknown,Venture - Series Unknown,300000.0,GBP,497886.0,300000.0,GBP,497886.0,,4.204,5.294,879.0,,,,AXM Venture Capital
568,Sol Global investments,"Calgary, Alberta, Canada",Active,For Profit,10.0,7.0,1.0,4.0,1.0,1.0,"Community and Lifestyle, Food and Beverage, Health Care","Cannabis, Pharmaceutical",3.0,IPO,2019-07-08,50000000.0,USD,50000000.0,Post-IPO Debt,Post-IPO Equity,28753480.0,CAD,22841758.0,73011987.0,USD,73011987.0,,3.069,,1.462,30023.0,USD,30023.0,Aphria
569,Manulife Financial,"Toronto, Ontario, Canada",Active,For Profit,14.0,3.0,,6.0,,,Financial Services,"Finance, Financial Services",1.0,IPO,2022-03-14,750000000.0,USD,750000000.0,Post-IPO Debt,,,,,750000000.0,USD,750000000.0,4.0,"1,819,061","1,741,906.5",556.0,33097.0,USD,33097.0,
570,MoEngage,"San Francisco, California, United States",Active,For Profit,,,,,7.0,13.0,"Data and Analytics, Information Technology, Sales and Marketing, Software","Analytics, Digital Marketing, Information Technology, Marketing Automation, SaaS",10.0,,2022-02-04,29634812.0,USD,29634812.0,Venture - Series Unknown,Venture - Series Unknown,29634812.0,USD,29634812.0,132969926.0,USD,132969926.0,3.0,"7,743,061","1,951,009",789.0,,,,"Alchemist Accelerator, F-Prime Capital, Steadview Capital, Matrix Partners India, Eight Roads Ventures"
571,Speedinvest,"Vienna, Wien, Austria",Active,For Profit,330.0,131.0,9.0,21.0,,,"Financial Services, Lending and Investments","Finance, Financial Services, Venture Capital",,,,,,,,,,,,,,,6.0,17.396,"24,214.67",259.0,32141910.0,USD,32141910.0,
572,Axonius,"New York, New York, United States",Active,For Profit,,,,,6.0,19.0,"Financial Services, Information Technology, Privacy and Security","Asset Management, Cloud Security, Cyber Security, Information Technology, Network Security",7.0,Late Stage Venture,2022-03-08,200000000.0,USD,200000000.0,Series E,Series E,200000000.0,USD,200000000.0,665000000.0,USD,665000000.0,4.0,55.177,"32,136.17",239.0,203948.0,USD,203948.0,"Vertex Ventures, Accel, Stripes, Bessemer Venture Partners, Lightspeed Venture Partners"
573,Ring,"Santa Monica, California, United States",Active,For Profit,,,,,8.0,23.0,"Consumer Electronics, Hardware, Privacy and Security, Real Estate","Consumer Electronics, Security, Smart Home",5.0,M&A,2017-01-25,109000000.0,USD,109000000.0,Series D,Series D,109000000.0,USD,109000000.0,203700000.0,USD,203700000.0,7.0,"18,759,465","21,997,526.5",545.0,,,,"M13, Qualcomm Ventures, Kleiner Perkins, First Round Capital, Upfront Ventures"
574,Hello Alice,"Houston, Texas, United States",Active,For Profit,,,,,6.0,17.0,"Information Technology, Sales and Marketing","Digital Marketing, Information Services, Information Technology",8.0,,2021-10-21,,,,Corporate Round,Corporate Round,,,,22474997.0,USD,22474997.0,4.0,218.33,"112,100.67",354.0,,,,"Alumni Ventures, QED Investors, Sherpa, Serena Ventures, SVB Capital"
575,Pierce,"Älvsjö, Stockholms Lan, Sweden",Active,For Profit,,,,,,,"Administrative Services, Commerce and Shopping, Internet Services, Sports, Transportation","Automotive, E-Commerce, Human Resources, Internet, Retail, Sporting Goods",,M&A,,,,,,,,,,,,,,35.597,"36,525.5",283.0,,,,
576,Saudi Arabia's Public Investment Fund,"Riyadh, Ar Riyad, Saudi Arabia",Active,,15.0,11.0,,8.0,,3.0,"Financial Services, Lending and Investments","Finance, Financial Services, Venture Capital",1.0,,2018-09-17,11000000000.0,USD,11000000000.0,Debt Financing,,,,,11000000000.0,USD,11000000000.0,,279.741,"93,096.83",837.0,,,,"HSBC, JP Morgan Chase, Goldman Sachs"
577,Northzone,"London, England, United Kingdom",Active,,246.0,99.0,12.0,44.0,,,"Financial Services, Lending and Investments, Professional Services","Business Development, Finance, FinTech, Venture Capital",,,,,,,,,,,,,,,,1.64,"7,806.17",18.0,,,,
578,Hg,"London, England, United Kingdom",Active,,50.0,39.0,2.0,23.0,,,"Financial Services, Lending and Investments","Finance, Financial Services, Venture Capital",1.0,,2016-10-28,,,,Venture - Series Unknown,Venture - Series Unknown,,,,,,,,43.48,"29,195.5",590.0,3376753.0,USD,3376753.0,
579,Swicorp,"Riyadh, Ar Riyad, Saudi Arabia",Active,,7.0,4.0,1.0,2.0,,,"Financial Services, Lending and Investments, Real Estate","Asset Management, Finance, Financial Services, Real Estate Investment, Venture Capital",,,,,,,,,,,,,,,,,,,,,,
