Id,Label,Headquarters Location,Operating Status,Company Type,Number of Investments,Number of Lead Investments,Number of Diversity Investments,Number of Exits,Number of Lead Investors,Number of Investors,Industry Groups,Industries,Number of Funding Rounds,Funding Status,Last Funding Date,Last Funding Amount,Last Funding Amount Currency,Last Funding Amount Currency (in USD),Last Funding Type,Last Equity Funding Type,Last Equity Funding Amount,Last Equity Funding Amount Currency,Last Equity Funding Amount Currency (in USD),Total Funding Amount,Total Funding Amount Currency,Total Funding Amount Currency (in USD),Number of Events,SEMrush - Monthly Visits,SEMrush - Average Visits (6 months),SEMrush - Visit Duration,Aberdeen - IT Spend,Aberdeen - IT Spend Currency,Aberdeen - IT Spend Currency (in USD),Principales inversionistas
0,Capital One,"Mclean, Virginia, United States",Active,For Profit,24.0,10.0,1.0,11.0,,,"Financial Services, Lending and Investments, Payments","Banking, Credit Cards, Finance, Financial Services",,IPO,,,,,,,,,,,,,93.0,"138,620,910","142,691,008.83",419.0,3209361088.0,USD,3209361088.0,
1,Hivemapper,"San Francisco, California, United States",Active,For Profit,,,,,2.0,26.0,"Data and Analytics, Navigation and Mapping","Geospatial, Navigation",3.0,Early Stage Venture,2022-04-05,18000000.0,USD,18000000.0,Series A,Series A,18000000.0,USD,18000000.0,21000000.0,USD,21000000.0,,17.141,15.542,168.0,,,,"Spark Capital, GV, 75 & Sunny, Craft Ventures, Founder Collective"
2,Innova Memphis,"Memphis, Tennessee, United States",Active,,305.0,61.0,104.0,9.0,,,"Agriculture and Farming, Financial Services, Health Care, Lending and Investments, Other, Transportation","AgTech, B2B, Logistics, Medical, Supply Chain Management, Venture Capital",,,,,,,,,,,,,,,,5.022,,7.0,,,,
3,NewView Capital,"Burlingame, California, United States",Active,For Profit,44.0,9.0,5.0,4.0,,,"Financial Services, Lending and Investments","Finance, Financial Services, Venture Capital",,,,,,,,,,,,,,,,5.948,,0.0,,,,
4,US Angel Investors,"Palo Alto, California, United States",Active,,3.0,,,,,,,,,,,,,,,,,,,,,,,1.132,,33.0,,,,
5,BNP Paribas,"Paris, Ile-de-France, France",Active,For Profit,53.0,13.0,,14.0,,,"Financial Services, Lending and Investments","Banking, Finance, Financial Services, Insurance, Personal Finance",,IPO,,,,,,,,,,,,,5.0,137.622,"168,948.17",334.0,,,,
6,Fannie Mae,"Washington, District of Columbia, United States",Active,For Profit,4.0,1.0,1.0,2.0,,,"Financial Services, Lending and Investments, Real Estate","Credit, Financial Services, Real Estate",,IPO,,,,,,,,,,,,,3.0,"1,469,502","1,170,149.33",566.0,10795271185.0,USD,10795271185.0,
7,Shrug Capital,"San Francisco, California, United States",Active,,64.0,,10.0,2.0,,,"Financial Services, Lending and Investments, Other","Consumer, Finance, Financial Services, Venture Capital",,,,,,,,,,,,,,,,2.853,"2,579.5",32.0,,,,
8,Almaz Capital,"Portola Valley, California, United States",Active,,84.0,36.0,3.0,18.0,,,"Financial Services, Lending and Investments","Finance, Financial Services, Venture Capital",,,,,,,,,,,,,,,11.0,,,,145189.0,USD,145189.0,
9,Fyllo,"Chicago, Illinois, United States",Active,For Profit,,,,,4.0,16.0,"Community and Lifestyle, Food and Beverage, Health Care, Information Technology, Internet Services, Professional Services, Software","Cannabis, Cloud Computing, Cloud Data Services, Compliance, Enterprise Software",5.0,Late Stage Venture,2021-11-08,40000000.0,USD,40000000.0,Series C,Series C,40000000.0,USD,40000000.0,98000000.0,USD,98000000.0,,99.416,"27,494.17",802.0,,,,"K2, Sol Global investments, ArrowMark Partners, Eminence Capital LP, Phyto Partners"
10,GMG Ventures,"London, England, United Kingdom",Active,,32.0,14.0,3.0,,,,"Financial Services, Lending and Investments, Professional Services","Business Development, Financial Services, Venture Capital",,,,,,,,,,,,,,,,,,,,,,
11,Yield Guild Games,"Quezon, Quezon City, Philippines",Active,For Profit,29.0,5.0,,,3.0,24.0,"Community and Lifestyle, Gaming, Other","Blockchain, Communities, Video Games",5.0,,2021-09-01,,,,Venture - Series Unknown,Venture - Series Unknown,,,,22400000.0,USD,22400000.0,,109.023,"115,085.5",388.0,,,,"Animoca Brands, Andreessen Horowitz, BlockTower Capital, BITKRAFT Ventures, Infinity Ventures Crypto"
12,Victory Park Capital,"Chicago, Illinois, United States",Active,,37.0,18.0,3.0,7.0,,,"Financial Services, Lending and Investments","Finance, Financial Services, Venture Capital",,,,,,,,,,,,,,,,12.473,"7,373.5",48.0,324534.0,USD,324534.0,
13,Max Ventures and Industries,"Noida, Uttar Pradesh, India",Active,For Profit,3.0,2.0,,1.0,,1.0,"Health Care, Manufacturing, Science and Engineering","Chemical, Manufacturing, Medical",1.0,IPO,2017-01-10,17800000.0,USD,17800000.0,Post-IPO Equity,Post-IPO Equity,17800000.0,USD,17800000.0,17800000.0,USD,17800000.0,,,,,,,,New York Life Insurance
14,TokenEx,"Edmond, Oklahoma, United States",Active,For Profit,,,,,1.0,1.0,"Financial Services, Information Technology, Payments, Privacy and Security, Software","Cyber Security, Payments, Security, Software",3.0,Early Stage Venture,2022-03-23,100000000.0,USD,100000000.0,Series B,Series B,100000000.0,USD,100000000.0,100500000.0,USD,100500000.0,3.0,"9,140,375","2,057,038.33",979.0,,,,K1 Investment Management
15,GuildFi,"Bangkok, Krung Thep, Thailand",Active,For Profit,8.0,1.0,,,2.0,11.0,"Apps, Gaming, Software","Apps, Gaming, Video Games",1.0,Seed,2021-11-10,6000000.0,USD,6000000.0,Seed,Seed,6000000.0,USD,6000000.0,6000000.0,USD,6000000.0,,57.21,601.937,136.0,,,,"Animoca Brands, Dapper Labs, Hashed, DeFiance Capital, Coinbase Ventures"
16,Encantos,"Culver City, California, United States",Active,For Profit,,,,,2.0,28.0,"Apps, Community and Lifestyle, Content and Publishing, Education, Media and Entertainment, Other, Software, Video","Apps, Children, Consumer, Content Creators, Digital Entertainment, EBooks, Education, Subscription Service, Video",4.0,Seed,2021-07-30,,,,Seed,Seed,,,,8500000.0,USD,8500000.0,,17.358,"7,043.5",8.0,,,,"Portfolia, Lightspeed Venture Partners, Precursor Ventures, Kapor Capital, Bossa Nova Investimentos"
17,George Kaiser Family Foundation,"Tulsa, Oklahoma, United States",Active,Non-profit,9.0,2.0,1.0,,,,"Financial Services, Other","Association, Charity, Finance, Non Profit",,,,,,,,,,,,,,,,9.896,"4,009.33",111.0,3550730.0,USD,3550730.0,
18,U.S. Department of Defense,"Washington, District of Columbia, United States",Active,For Profit,97.0,66.0,13.0,35.0,,,Government and Military,"National Security, Politics",,,,,,,,,,,,,,,1.0,"4,089,859","2,559,111.5",364.0,,,,
19,Welcome Tech,"Los Angeles, California, United States",Active,For Profit,,,,,4.0,12.0,"Community and Lifestyle, Data and Analytics, Design, Financial Services, Health Care, Lending and Investments","Banking, Communities, Financial Services, Health Care, Market Research",6.0,,2022-04-14,30000000.0,USD,30000000.0,Venture - Series Unknown,Venture - Series Unknown,30000000.0,USD,30000000.0,73000000.0,USD,73000000.0,,23.857,,0.0,,,,"SB Opportunity Fund, TTV Capital, Owl Ventures, Crosscut Ventures, Next Play Capital"
20,Glassdoor,"Mill Valley, California, United States",Active,For Profit,13.0,,4.0,5.0,7.0,11.0,"Internet Services, Media and Entertainment, Professional Services","Career Planning, Digital Media, Employment, Recruiting, Social Media",10.0,M&A,2017-01-26,,,,Secondary Market,Series H,40000000.0,USD,40000000.0,204500000.0,USD,204500000.0,1.0,"73,755,496","65,091,302.17",413.0,,,,"Tiger Global Management, T. Rowe Price, CapitalG, Benchmark, EquityZen"
21,Spotify,"Stockholm, Stockholms Lan, Sweden",Active,For Profit,5.0,3.0,1.0,1.0,10.0,53.0,"Internet Services, Media and Entertainment, Music and Audio, Software","Audio, Cloud Computing, Music, Music Streaming",19.0,IPO,2021-02-25,,,,Post-IPO Equity,Post-IPO Equity,,,,2085424679.0,USD,2085424679.0,32.0,"452,401,544","298,088,942.67",473.0,,,,"Tencent, Goldman Sachs, TPG, Accel, Fidelity"
22,General Motors,"Detroit, Michigan, United States",Active,For Profit,21.0,14.0,3.0,6.0,,2.0,"Information Technology, Manufacturing, Transportation","Automotive, Electric Vehicle, Information Services, Manufacturing, Transportation",2.0,IPO,2011-02-01,150922.0,USD,150922.0,Grant,,,,,505313.0,USD,505313.0,8.0,"11,817,451","6,064,794.17",563.0,2086643559.0,USD,2086643559.0,"Fannie Mae, NYSERDA"
23,UpScalio,"Gurgaon, Haryana, India",Active,For Profit,9.0,9.0,,,3.0,18.0,"Commerce and Shopping, Financial Services, Internet Services, Lending and Investments","E-Commerce Platforms, Financial Services, Impact Investing",5.0,Early Stage Venture,2022-03-15,15000000.0,USD,15000000.0,Series B,Series B,15000000.0,USD,15000000.0,62500000.0,USD,62500000.0,,4.184,"9,540.17",174.0,,,,"Northern Arc, OfBusiness, 468 Capital, Kingsway Capital, Heliad Equity Partners"
24,ICICI Lombard General Insurance,"Mumbai, Maharashtra, India",Active,For Profit,2.0,,,1.0,,,Financial Services,"Health Insurance, Insurance, Life Insurance",1.0,IPO,2020-06-19,22500000000.0,INR,295073260.0,Post-IPO Secondary,,,,,22500000000.0,INR,295073260.0,,"2,320,356","2,249,126.83",1.072,,,,
25,Madrona Venture Group,"Seattle, Washington, United States",Active,,444.0,159.0,54.0,92.0,,,"Financial Services, Lending and Investments","Angel Investment, Finance, Financial Services, Venture Capital",,,,,,,,,,,,,,,4.0,316,"7,821.67",41.0,47544.0,USD,47544.0,
26,Morpheus Ventures,"Los Angeles, California, United States",Active,,31.0,13.0,4.0,3.0,,,"Financial Services, Lending and Investments","Finance, Financial Services, FinTech, Venture Capital",,,,,,,,,,,,,,,,2.838,"2,266.5",4.0,,,,
27,Electric Capital,"Palo Alto, California, United States",Active,,57.0,19.0,4.0,,,1.0,"Financial Services, Lending and Investments, Other, Payments, Software","Blockchain, Cryptocurrency, Financial Services, FinTech, Venture Capital",1.0,Early Stage Venture,2018-05-15,,,,Series A,Series A,,,,,,,,13.93,"13,327.5",887.0,,,,MaC Venture Capital
28,J-Ventures,"Palo Alto, California, United States",Active,For Profit,38.0,2.0,6.0,4.0,,,"Commerce and Shopping, Education, Health Care, Real Estate, Sales and Marketing, Software","Construction, Education, Marketing, Medical, Retail, Web Development",,,,,,,,,,,,,,,,2.943,,168.0,,,,
29,LinkSquares,"Boston, Massachusetts, United States",Active,For Profit,,,,,5.0,14.0,"Artificial Intelligence, Data and Analytics, Professional Services, Science and Engineering, Software","Artificial Intelligence, Legal Tech, Machine Learning, Productivity Tools, Software",6.0,Late Stage Venture,2022-04-04,100000000.0,USD,100000000.0,Series C,Series C,100000000.0,USD,100000000.0,161469800.0,USD,161469800.0,,14.543,"32,093.67",66.0,89459.0,USD,89459.0,"Xerox, Jump Capital, G Squared, Hyperplane Venture Capital, Touchdown Ventures"
30,Newark Venture Partners,"Newark, New Jersey, United States",Active,,124.0,17.0,55.0,11.0,,,"Financial Services, Lending and Investments","Finance, Financial Services, Venture Capital",,,,,,,,,,,,,,,8.0,3.496,"3,610.33",92.0,,,,
31,Reach Capital,"San Francisco, California, United States",Active,,106.0,28.0,51.0,14.0,,,"Education, Financial Services, Software","Consumer Software, EdTech, Enterprise Software, Financial Services",,,,,,,,,,,,,,,1.0,13.117,"7,131.67",40.0,126574.0,USD,126574.0,
32,TravelPerk,"Barcelona, Catalonia, Spain",Active,For Profit,,,,,7.0,28.0,"Events, Media and Entertainment, Software, Travel and Tourism","Business Travel, Software, Ticketing, Travel",9.0,Late Stage Venture,2022-01-12,115000000.0,USD,115000000.0,Series D,Series D,115000000.0,USD,115000000.0,408175372.0,USD,408175372.0,9.0,"1,244,217","340,168.17",945.0,,,,"General Catalyst, Spark Capital, Felix Capital, Latitude, LocalGlobe"
33,Mubadala,"Abu Dhabi, Abu Dhabi, United Arab Emirates",Active,For Profit,48.0,19.0,4.0,12.0,,,Financial Services,"Asset Management, Financial Services, FinTech",,,,,,,,,,,,,,,,62.365,"56,132.33",252.0,,,,
34,AgentSync,"Denver, Colorado, United States",Active,For Profit,,,,,4.0,19.0,"Financial Services, Information Technology, Professional Services, Sales and Marketing, Software","Compliance, Information Technology, Insurance, SaaS, Sales, Software",4.0,Early Stage Venture,2021-12-07,75000000.0,USD,75000000.0,Series B,Series B,75000000.0,USD,75000000.0,111100000.0,USD,111100000.0,,62.365,"16,267.5",339.0,,,,"Tiger Global Management, Anthemis Group, Craft Ventures, Valor Equity Partners, Caffeinated Capital"
35,FLASH,"Austin, Texas, United States",Active,For Profit,,,,,2.0,4.0,"Other, Real Estate, Software, Transportation","Infrastructure, Parking, Property Management, Software",4.0,Private Equity,2022-03-16,250000000.0,USD,250000000.0,Private Equity,Private Equity,250000000.0,USD,250000000.0,314250000.0,USD,314250000.0,,30,"12,721.17",49.0,133780.0,USD,133780.0,"Vista Equity Partners, L Catterton, Austin Ventures, Geekdom Fund"
36,JULO,"Jakarta, Jakarta Raya, Indonesia",Active,For Profit,,,,,4.0,12.0,"Financial Services, Lending and Investments","Consumer Lending, Credit, Finance, Financial Services, FinTech, Lending",6.0,,2022-04-13,50000000.0,USD,50000000.0,Debt Financing,Corporate Round,30000000.0,USD,30000000.0,155000000.0,USD,155000000.0,,"1,322,922","245,257.83",364.0,,,,"Quona Capital, East Ventures, Gobi Partners, Skystar Capital, Credit Saison"
37,Flybridge,"Boston, Massachusetts, United States",Active,,384.0,99.0,71.0,66.0,,,"Financial Services, Lending and Investments","Finance, Financial Services, Impact Investing, Venture Capital",,,,,,,,,,,,,,,2.0,12.152,"4,615.83",0.0,353990.0,USD,353990.0,
38,Cohesity,"San Jose, California, United States",Active,For Profit,,,,,9.0,26.0,"Data and Analytics, Hardware, Information Technology, Internet Services, Software","Analytics, Cloud Computing, Data Center, Data Storage, Information Technology",6.0,Late Stage Venture,2020-04-09,250000000.0,USD,250000000.0,Series E,Series E,250000000.0,USD,250000000.0,660000000.0,USD,660000000.0,45.0,500.799,"310,839.67",1.5,17063309.0,USD,17063309.0,"Sequoia Capital, GV, SoftBank Vision Fund, Accel, Baillie Gifford"
39,Rhapsody Venture Partners,"Cambridge, Massachusetts, United States",Active,,26.0,13.0,7.0,,,,"Biotechnology, Consumer Electronics, Food and Beverage, Hardware, Science and Engineering, Transportation","Automotive, Biotechnology, Electronics, Food and Beverage",,,,,,,,,,,,,,,,,,,,,,
40,Vedantu,"Bangalore, Karnataka, India",Active,For Profit,1.0,1.0,,1.0,10.0,12.0,"Education, Software","E-Learning, EdTech, Education, Tutoring",11.0,Late Stage Venture,2022-02-24,2000000.0,USD,2000000.0,Series E,Series E,2000000.0,USD,2000000.0,292886532.0,USD,292886532.0,,"16,996,471","28,655,260.17",800.0,,,,"Tiger Global Management, Accel, Coatue, TAL Education Group, 9Unicorns Accelerator Fund"
41,Bain Capital Ventures,"San Francisco, California, United States",Active,,552.0,246.0,84.0,113.0,,,"Financial Services, Lending and Investments","Finance, Financial Services, Venture Capital",,,,,,,,,,,,,,,3.0,23.478,12.512,166.0,,,,
42,ITILITE,"Bangalore, Karnataka, India",Active,For Profit,,,,,3.0,7.0,"Information Technology, Internet Services, Travel and Tourism","Business Travel, Information Technology, Internet, Travel",4.0,Late Stage Venture,2022-04-13,2210000000.0,INR,29032361.0,Series C,Series C,2210000000.0,INR,29032361.0,46304087.0,USD,46304087.0,,408.752,"218,609.83",1.436,,,,"Dharana Capital, Tiger Global Management, Matrix Partners, Matrix Partners India, Ashish Gupta"
43,Alloy,"New York, New York, United States",Active,For Profit,,,,,7.0,22.0,"Financial Services, Information Technology, Payments, Privacy and Security, Professional Services, Software","Compliance, FinTech, Fraud Detection, Identity Management, SaaS, Software",9.0,Late Stage Venture,2021-09-30,100000000.0,USD,100000000.0,Series C,Series C,100000000.0,USD,100000000.0,155800000.0,USD,155800000.0,2.0,77.252,"36,564.67",608.0,7564.0,USD,7564.0,"Techstars, Flourish Ventures, Bessemer Venture Partners, Lightspeed Venture Partners, Primary Venture Partners"
44,Doceree,"Parsippany, New Jersey, United States",Active,For Profit,,,,,3.0,7.0,"Advertising, Health Care, Information Technology, Sales and Marketing, Software","Advertising, Health Care, Information Technology, Marketing, Software",4.0,Early Stage Venture,2022-04-06,11000000.0,USD,11000000.0,Series A,Series A,11000000.0,USD,11000000.0,12000000.0,USD,12000000.0,,"1,890,533","374,690.5",165.0,,,,"F-Prime Capital, Eight Roads Ventures, Alkemi Venture Partners, Debasish Hota, Harsh Gupta"
45,InnoVen Capital,"Mumbai, Maharashtra, India",Active,,196.0,144.0,2.0,33.0,,,Financial Services,"Finance, FinTech",,M&A,,,,,,,,,,,,,,2.875,,857.0,,,,
46,Pindrop,"Atlanta, Georgia, United States",Active,For Profit,,,,,4.0,25.0,"Artificial Intelligence, Data and Analytics, Financial Services, Media and Entertainment, Music and Audio, Payments, Privacy and Security, Software","Audio, Fraud Detection, Natural Language Processing, Security, Software, Speech Recognition",6.0,,2021-03-17,6800000.0,USD,6800000.0,Undisclosed,Undisclosed,6800000.0,USD,6800000.0,219599996.0,USD,219599996.0,11.0,23.918,"14,383.5",12.0,,,,"Andreessen Horowitz, Goldman Sachs, GV, Redpoint, Vitruvian Partners"
47,Pax8,"Greenwood Village, Colorado, United States",Active,For Profit,,,,,4.0,7.0,"Commerce and Shopping, Information Technology, Internet Services, Other, Software","Cloud Management, Enterprise Software, Infrastructure, Marketplace",9.0,,2022-04-11,185000000.0,USD,185000000.0,Venture - Series Unknown,Venture - Series Unknown,185000000.0,USD,185000000.0,350520000.0,USD,350520000.0,10.0,173.034,206.397,383.0,14114579.0,USD,14114579.0,"SoftBank Vision Fund, Avenir Growth Capital, Blue Cloud Ventures, Catalyst Investors, Sageview Capital"
48,Zilch,"London, England, United Kingdom",Active,For Profit,,,,,4.0,6.0,"Financial Services, Lending and Investments, Payments","Banking, Financial Services, FinTech, Payments",5.0,Late Stage Venture,2021-11-10,95000000.0,EUR,109116010.0,Series C,Series C,95000000.0,EUR,109116010.0,339343574.0,USD,339343574.0,,584.195,"254,578.17",119.0,,,,"Goldman Sachs Asset Management, Ventura Capital, dmg ventures, Gauss Ventures, M&F Fund"
49,Rapid7,"Boston, Massachusetts, United States",Active,For Profit,1.0,,,,2.0,2.0,"Data and Analytics, Information Technology, Privacy and Security, Professional Services, Software","Analytics, Cyber Security, Enterprise Software, Risk Management",4.0,IPO,2014-12-17,30000000.0,USD,30000000.0,Series D,Series D,30000000.0,USD,30000000.0,89000000.0,USD,89000000.0,56.0,"1,984,219","1,374,959.5",963.0,59279009.0,USD,59279009.0,"TCV, Bain Capital Ventures"
50,Click Therapeutics,"New York, New York, United States",Active,For Profit,,,,,6.0,15.0,"Biotechnology, Health Care, Science and Engineering","Biotechnology, Health Care, Medical Device, Pharmaceutical, Therapeutics",11.0,Early Stage Venture,2022-04-15,15000000.0,USD,15000000.0,Debt Financing,Series B,52000000.0,USD,52000000.0,926382500.0,USD,926382500.0,,7.65,"6,669.83",0.0,,,,"Silicon Valley Bank, Hikma Ventures, Boehringer Ingelheim, Health Catalyst Capital, Sanofi Ventures"
51,Amadeus Capital Partners,"Cambridge, Cambridgeshire, United Kingdom",Active,,255.0,72.0,,52.0,,,"Financial Services, Lending and Investments","Finance, Financial Services, Venture Capital",,,,,,,,,,,,,,,,8.075,"4,644.33",393.0,3446157.0,USD,3446157.0,
52,Next Play Capital,"Redwood City, California, United States",Active,,43.0,,12.0,8.0,,,"Financial Services, Lending and Investments","Financial Services, FinTech, Impact Investing, Venture Capital",,,,,,,,,,,,,,,1.0,6.956,2.813,0.0,,,,
53,Bigpoint,"Hamburg, Hamburg, Germany",Active,For Profit,4.0,,,2.0,,5.0,Gaming,"Casual Games, Gaming, MMO Games",3.0,M&A,2011-04-26,350000000.0,USD,350000000.0,Private Equity,Private Equity,350000000.0,USD,350000000.0,459870792.0,USD,459870792.0,,133.352,"224,493.17",1.75,5223573.0,USD,5223573.0,"TA Associates, Summit Partners, GMT Capital, Peacock Equity, GMT Communications Partners"
54,Meituan,"Beijing, Beijing, China",Active,For Profit,54.0,22.0,,2.0,3.0,20.0,"Commerce and Shopping, Food and Beverage, Internet Services, Sales and Marketing, Transportation","E-Commerce, Food Delivery, Internet, Local Business",8.0,IPO,2021-04-19,6588000000.0,USD,6588000000.0,Post-IPO Equity,Post-IPO Equity,6588000000.0,USD,6588000000.0,17288000000.0,USD,17288000000.0,,,,,,,,"Tencent, IDG Capital, Baillie Gifford, Coatue, Temasek Holdings"
55,Great Hill Partners,"Boston, Massachusetts, United States",Active,,78.0,50.0,9.0,36.0,1.0,1.0,"Financial Services, Lending and Investments","Banking, Finance, Venture Capital",1.0,Private Equity,2021-11-12,,,,Private Equity,Private Equity,,,,,,,,57.433,"14,593.33",2.763,95493.0,USD,95493.0,Blackstone Group
56,Golub Capital,"San Francisco, California, United States",Active,,31.0,12.0,3.0,14.0,,1.0,"Financial Services, Lending and Investments","Credit, Finance, Financial Services, Venture Capital",1.0,Private Equity,2018-08-03,,,,Private Equity,Private Equity,,,,,,,,15.95,"10,751.5",510.0,,,,Dyal Capital Partners
57,Hopper,"Montréal, Quebec, Canada",Active,For Profit,,,,,8.0,22.0,"Apps, Artificial Intelligence, Data and Analytics, Mobile, Software, Travel and Tourism","Apps, Big Data, Mobile Apps, Predictive Analytics, Travel",11.0,Late Stage Venture,2022-02-02,35000000.0,USD,35000000.0,Secondary Market,Series G,175000000.0,USD,175000000.0,633679549.0,USD,633679549.0,2.0,"5,682,096","1,707,589",513.0,775313.0,USD,775313.0,"Citi, Goldman Sachs, Brightspark Ventures, OMERS Ventures, Khaira Capital"
58,FirstMark,"New York, New York, United States",Active,,328.0,117.0,52.0,49.0,,,"Financial Services, Lending and Investments, Other, Professional Services","Business Development, Consumer, Enterprise, Finance, Financial Services, Venture Capital",,,,,,,,,,,,,,,3.0,8.478,"6,833.5",53.0,3539670.0,USD,3539670.0,
59,Optimism,"New York, New York, United States",Active,For Profit,,,,,2.0,3.0,"Financial Services, Other, Payments, Software","Blockchain, Cryptocurrency, Ethereum, FinTech",3.0,Early Stage Venture,2022-03-17,150000000.0,USD,150000000.0,Series B,Series B,150000000.0,USD,150000000.0,178500000.0,USD,178500000.0,,94.251,"152,909.83",375.0,,,,"Andreessen Horowitz, Paradigm, IDEO CoLab Ventures"
60,Social Impact Capital,"New York, New York, United States",Active,,39.0,5.0,14.0,2.0,,,,,,,,,,,,,,,,,,,1.0,294,,1.0,,,,
61,Refactor Capital,"Burlingame, California, United States",Active,,71.0,7.0,23.0,6.0,,,"Financial Services, Lending and Investments",Venture Capital,,,,,,,,,,,,,,,,121.401,,137.0,,,,
62,Crowdcube,"Exeter, Devon, United Kingdom",Active,For Profit,650.0,31.0,7.0,8.0,5.0,13.0,"Financial Services, Lending and Investments, Professional Services","Business Development, Crowdfunding, Financial Services, FinTech, Funding Platform, Venture Capital",15.0,,2022-03-15,2564160.0,GBP,3344768.0,Secondary Market,Equity Crowdfunding,2000000.0,GBP,2655354.0,64068292.0,USD,64068292.0,5.0,394.495,"442,451.83",440.0,14363682.0,USD,14363682.0,"Crowdcube, Circle, Draper Associates, Molten Ventures, Balderton Capital"
63,Kingsway Capital,"London, England, United Kingdom",Active,For Profit,52.0,14.0,1.0,1.0,,,Financial Services,"Finance, Financial Services",,,,,,,,,,,,,,,,17.032,,81.0,12714187.0,USD,12714187.0,
64,GSR Ventures,"Palo Alto, California, United States",Active,,347.0,96.0,27.0,22.0,,,"Artificial Intelligence, Data and Analytics, Financial Services, Lending and Investments, Professional Services, Science and Engineering, Software","Artificial Intelligence, Business Development, Finance, Financial Services, FinTech, Venture Capital",,,,,,,,,,,,,,,,,,,,,,
65,Jerry,"Palo Alto, California, United States",Active,For Profit,,,,,1.0,38.0,"Artificial Intelligence, Data and Analytics, Financial Services, Science and Engineering, Software","Artificial Intelligence, Auto Insurance, Insurance, InsurTech",5.0,Late Stage Venture,2021-08-10,75000000.0,USD,75000000.0,Series C,Series C,75000000.0,USD,75000000.0,132000000.0,USD,132000000.0,,"4,543,547","900,669.33",586.0,,,,"Goodwater Capital, FundersClub, Y Combinator, Liquid 2 Ventures, Plug and Play Tech Center"
66,Threshold,"Menlo Park, California, United States",Active,,877.0,217.0,101.0,196.0,,,"Financial Services, Lending and Investments, Professional Services","Business Development, Finance, Financial Services, Venture Capital",,,,,,,,,,,,,,,1.0,3.965,"4,533.83",0.0,,,,
67,ZestMoney,"Bangalore, Karnataka, India",Active,For Profit,,,,,7.0,16.0,"Data and Analytics, Financial Services, Lending and Investments","Big Data, Consumer Lending, Financial Services, FinTech",10.0,Late Stage Venture,2021-09-22,50000000.0,USD,50000000.0,Series C,Series C,50000000.0,USD,50000000.0,118373925.0,USD,118373925.0,1.0,919.169,"1,204,525.83",580.0,,,,"Zip, Goldman Sachs, PayU, Quona Capital, Coinbase Ventures"
68,SAP,"Walldorf, Baden-Wurttemberg, Germany",Active,For Profit,29.0,7.0,,14.0,1.0,2.0,"Consumer Electronics, Data and Analytics, Financial Services, Hardware, Software","Analytics, Business Intelligence, Computer, Finance, Software",2.0,IPO,2019-04-24,1300000000.0,USD,1300000000.0,Post-IPO Equity,Post-IPO Equity,1300000000.0,USD,1300000000.0,1301371240.0,USD,1301371240.0,239.0,"27,548,849","26,208,156.17",544.0,67473085.0,USD,67473085.0,"Elliott Management, EASME - EU Executive Agency for SMEs"
69,Aura,"Boston, Massachusetts, United States",Active,For Profit,,,,,4.0,6.0,"Information Technology, Privacy and Security","Cyber Security, Information Technology, Network Security, Security",3.0,Late Stage Venture,2021-10-19,200000000.0,USD,200000000.0,Series F,Series F,200000000.0,USD,200000000.0,500000000.0,USD,500000000.0,,609.767,"235,135.67",560.0,,,,"Warburg Pincus, General Catalyst, Accel, WndrCo, Madrone Capital Partners"
70,LVL1 Group,"Limassol, Limassol, Cyprus",Active,For Profit,43.0,9.0,1.0,6.0,,,"Financial Services, Lending and Investments",Venture Capital,,,,,,,,,,,,,,,,549,,0.0,,,,
