1592,SESO,"San Francisco, California, United States",Active,For Profit,,,,,1.0,12.0,"Administrative Services, Agriculture and Farming, Commerce and Shopping","Agriculture, AgTech, Farming, Human Resources, Marketplace, Staffing Agency",4.0,Early Stage Venture,2022-04-14,25000000.0,USD,25000000.0,Series A,Series A,25000000.0,USD,25000000.0,29500000.0,USD,29500000.0,,7.645,,0.0,,,,"Founders Fund, Index Ventures, HOF Capital, Shrug Capital, Connor Theilmann"
1593,Cloudera,"Palo Alto, California, United States",Active,For Profit,,,,,6.0,23.0,"Artificial Intelligence, Data and Analytics, Internet Services, Science and Engineering, Software","Analytics, Artificial Intelligence, Big Data, Cloud Computing, Enterprise Software, Machine Learning",13.0,M&A,2018-04-07,,,,Post-IPO Secondary,Venture - Series Unknown,,,,1041000000.0,USD,1041000000.0,113.0,"1,880,468","2,118,171.33",535.0,125226018.0,USD,125226018.0,"Greylock, GV, T. Rowe Price, Accel, In-Q-Tel"
1594,Section 32,"San Diego, California, United States",Active,,87.0,18.0,17.0,14.0,,,"Financial Services, Lending and Investments","Finance, Financial Services, Venture Capital",,,,,,,,,,,,,,,,2.753,"4,452.67",0.0,,,,
1595,Truora,"Cali, Valle del Cauca, Colombia",Active,For Profit,,,,,4.0,18.0,"Information Technology, Privacy and Security, Software","Developer Platform, Information Services, Security",4.0,Early Stage Venture,2022-04-08,15000000.0,USD,15000000.0,Series A,Series A,15000000.0,USD,15000000.0,18650000.0,USD,18650000.0,,28.505,"11,450.5",114.0,,,,"Y Combinator, Accel, Magma Partners, Propel Venture Partners, Alex Bouaziz"
1596,Arena.im,"San Francisco, California, United States",Active,For Profit,,,,,3.0,10.0,"Commerce and Shopping, Content and Publishing, Information Technology, Internet Services, Media and Entertainment, Messaging and Telecommunications, Other, Software","B2B, E-Commerce, Enterprise Software, Publishing, Real Time, Social Media, Social Shopping, Video Chat, Web Development",5.0,Early Stage Venture,2022-03-30,13600000.0,USD,13600000.0,Series A,Series A,13600000.0,USD,13600000.0,16000000.0,USD,16000000.0,,146.912,"55,135.33",281.0,,,,"Techstars, Craft Ventures, Right Side Capital Management, Incubate Fund, CRV"
1597,Ubisoft,"Montreuil-sous-bois, Ile-de-France, France",Active,For Profit,9.0,,,1.0,1.0,4.0,"Content and Publishing, Gaming, Media and Entertainment","Media and Entertainment, Publishing, Video Games",3.0,IPO,2018-03-21,618000000.0,EUR,763021367.0,Post-IPO Secondary,Post-IPO Equity,50000000.0,CNY,7629264.0,770650631.0,USD,770650631.0,16.0,"32,820,567","27,881,933.83",392.0,,,,"Tencent, JP Morgan Chase, Ontario Teachers' Pension Plan, Electronic Arts"
1598,OYO,"Gurgaon, Haryana, India",Active,For Profit,1.0,,,,12.0,28.0,Travel and Tourism,"Hospitality, Travel, Travel Accommodations",22.0,Late Stage Venture,2022-01-13,2300000000.0,INR,31092655.0,Secondary Market,Series F,5000000.0,USD,5000000.0,3076477508.0,USD,3076477508.0,1.0,"3,353,272","4,076,121.33",529.0,,,,"SoftBank, Microsoft, Airbnb, Grab, SoftBank Vision Fund"
1599,Vanke,"Shenzhen, Guangdong, China",Active,For Profit,9.0,6.0,,3.0,,,Real Estate,"Commercial Real Estate, Real Estate",1.0,IPO,2019-03-28,995000000.0,USD,995000000.0,Post-IPO Equity,Post-IPO Equity,995000000.0,USD,995000000.0,995000000.0,USD,995000000.0,1.0,103.971,"83,722.5",1.109,,,,
1600,Verlinvest,"Brussels, Brussels Hoofdstedelijk Gewest, Belgium",Active,,45.0,25.0,1.0,7.0,,,"Food and Beverage, Health Care","Food and Beverage, Health Care",,,,,,,,,,,,,,,,533,7.952,27.0,,,,
1601,Karlin Ventures,"Los Angeles, California, United States",Active,,51.0,5.0,15.0,14.0,,,"Advertising, Commerce and Shopping, Financial Services, Lending and Investments, Sales and Marketing","Advertising, E-Commerce, Venture Capital",,,,,,,,,,,,,,,,,,,,,,
1602,Cogoport,"Mumbai, Maharashtra, India",Active,For Profit,,,,,2.0,3.0,Transportation,"Air Transportation, Freight Service, Logistics, Marine Transportation",5.0,Early Stage Venture,2022-04-06,50000000.0,USD,50000000.0,Series B,Series B,50000000.0,USD,50000000.0,67039911.0,USD,67039911.0,,279.125,"107,149.83",139.0,,,,"Tiger Global Management, Accel, DST Global"
1603,Impact America Fund,"Oakland, California, United States",Active,,25.0,3.0,21.0,2.0,,,"Financial Services, Lending and Investments, Other","Enterprise, Financial Services, Small and Medium Businesses, Venture Capital",,,,,,,,,,,,,,,,12.388,"4,063.17",0.0,,,,
1604,SpotOn,"San Francisco, California, United States",Active,For Profit,,,,,4.0,13.0,"Financial Services, Information Technology, Mobile, Payments, Sales and Marketing, Software","Mobile Payments, Payments, Sales Automation, Software",7.0,Late Stage Venture,2021-09-13,300000000.0,USD,300000000.0,Series E,Series E,300000000.0,USD,300000000.0,628000000.0,USD,628000000.0,2.0,"1,075,297","990,911.17",382.0,98952.0,USD,98952.0,"Andreessen Horowitz, Mubadala, Coatue, Franklin Templeton Investments, Wellington Management"
1605,Forto,"Berlin, Berlin, Germany",Active,For Profit,,,,,7.0,17.0,"Software, Transportation","Freight Service, Logistics, Shipping, Software, Supply Chain Management",6.0,Late Stage Venture,2022-03-07,250000000.0,USD,250000000.0,Series D,Series D,250000000.0,USD,250000000.0,593383184.0,USD,593383184.0,,54.038,"73,431.33",1.2,,,,"SoftBank Vision Fund, Global Founders Capital, Northzone, Disruptive, Cherry Ventures"
1606,Access Industries,"New York, New York, United States",Active,,73.0,23.0,13.0,21.0,,,"Manufacturing, Natural Resources, Science and Engineering, Sustainability","Chemical, Industrial, Natural Resources",,,,,,,,,,,,,,,,3.461,2.624,85.0,492367568.0,USD,492367568.0,
1607,6sense,"San Francisco, California, United States",Active,For Profit,,,,,9.0,18.0,"Artificial Intelligence, Data and Analytics, Information Technology, Other, Sales and Marketing, Science and Engineering, Software","Artificial Intelligence, B2B, Big Data, Business Information Systems, Machine Learning, Marketing, Sales",7.0,Late Stage Venture,2022-01-20,200000000.0,USD,200000000.0,Series E,Series E,200000000.0,USD,200000000.0,426000000.0,USD,426000000.0,6.0,"7,513,436","1,335,243.33",642.0,186671.0,USD,186671.0,"B Capital Group, Insight Partners, Tiger Global Management, Blue Owl, SoftBank Vision Fund"
1608,Arweave,"London, England, United Kingdom",Active,For Profit,12.0,2.0,,,1.0,15.0,"Financial Services, Hardware, Internet Services, Other, Payments, Software","Blockchain, Cryptocurrency, Data Storage, Internet",7.0,,2020-12-01,,,,Initial Coin Offering,Initial Coin Offering,,,,22000000.0,USD,22000000.0,,67.544,"90,287.67",261.0,,,,"Techstars, Andreessen Horowitz, Union Square Ventures, Coinbase Ventures, Arrington XRP Capital"
1609,Deserve,"Palo Alto, California, United States",Active,For Profit,,,,,12.0,21.0,"Data and Analytics, Financial Services, Internet Services, Lending and Investments, Mobile, Payments, Software","Big Data, Credit Cards, FinTech, Internet, Mobile Payments",10.0,,2021-10-27,,,,Corporate Round,Corporate Round,,,,294200000.0,USD,294200000.0,2.0,352.43,"192,507.67",233.0,,,,"Alumni Ventures, Goldman Sachs, Mastercard, Accel, Credit Suisse"
1610,Khosla Ventures,"Menlo Park, California, United States",Active,,1.008,351.0,181.0,140.0,,,"Financial Services, Lending and Investments, Professional Services","Business Development, Finance, Financial Services, Venture Capital",,,,,,,,,,,,,,,,51.539,"23,938.83",46.0,1173080.0,USD,1173080.0,
1611,OpenWeb,"New York, New York, United States",Active,For Profit,,,,,3.0,20.0,"Artificial Intelligence, Community and Lifestyle, Content and Publishing, Data and Analytics, Internet Services, Media and Entertainment, Software","Internet, Machine Learning, Online Forums, Publishing, Social",5.0,Late Stage Venture,2021-11-09,150000000.0,USD,150000000.0,Series E,Series E,150000000.0,USD,150000000.0,223000000.0,USD,223000000.0,3.0,689.072,"142,586.67",121.0,,,,"Insight Partners, AltaIR Capital, Samsung NEXT, Entrée Capital, The New York Times"
1612,Biomedical Advanced Research and Development Authority (BARDA),"Washington, District of Columbia, United States",Active,Non-profit,37.0,32.0,1.0,19.0,,,"Biotechnology, Health Care, Science and Engineering","Biotechnology, Health Care",,,,,,,,,,,,,,,,8.023,"6,395.83",78.0,,,,
1613,Zoom,"San Jose, California, United States",Active,For Profit,24.0,12.0,1.0,3.0,5.0,19.0,"Hardware, Information Technology, Internet Services, Messaging and Telecommunications, Other, Software","Collaboration, Information Technology, Messaging, Video Conferencing",8.0,IPO,2021-11-04,130000000.0,USD,130000000.0,Post-IPO Equity,Post-IPO Equity,130000000.0,USD,130000000.0,276000000.0,USD,276000000.0,44.0,"637,716,832","669,087,972.17",745.0,204574021.0,USD,204574021.0,"Sequoia Capital, Qualcomm Ventures, DCVC, Horizons Ventures, AME Cloud Ventures"
1614,CertiK,"New York, New York, United States",Active,For Profit,,,,,10.0,18.0,"Information Technology, Other, Privacy and Security, Software","Blockchain, Cyber Security, Software",8.0,Early Stage Venture,2022-04-22,60000000.0,USD,60000000.0,Series B,Series B,60000000.0,USD,60000000.0,300200000.0,USD,300200000.0,,636.221,"561,431.5",446.0,,,,"Lenovo, Sequoia Capital, Goldman Sachs, IDG Capital, Hillhouse Capital Group"
1615,I Squared Capital,"New York, New York, United States",Active,,11.0,5.0,,1.0,,,"Financial Services, Lending and Investments","Finance, Financial Services, Venture Capital",,,,,,,,,,,,,,,,5.305,7.004,0.0,,,,
1616,Forerunner Ventures,"San Francisco, California, United States",Active,,218.0,60.0,96.0,27.0,,,"Commerce and Shopping, Financial Services, Hardware, Internet Services, Lending and Investments, Software","FinTech, Internet, Retail, Retail Technology, Venture Capital",,,,,,,,,,,,,,,1.0,10.881,6.691,98.0,,,,
1617,CircleUp,"San Francisco, California, United States",Active,For Profit,91.0,23.0,40.0,9.0,5.0,21.0,"Data and Analytics, Financial Services, Lending and Investments","Analytics, Financial Services, FinTech, Venture Capital",6.0,Late Stage Venture,2019-09-20,200000000.0,USD,200000000.0,Debt Financing,Series C,30000000.0,USD,30000000.0,253000000.0,USD,253000000.0,,28.332,"14,705.83",293.0,,,,"Union Square Ventures, GV, QED Investors, Clocktower Technology Ventures, Rose Park Advisors"
1618,Correlation Ventures,"San Diego, California, United States",Active,,322.0,5.0,82.0,59.0,,,"Financial Services, Lending and Investments","Finance, Financial Services, Venture Capital",,,,,,,,,,,,,,,,2.852,"5,333.67",0.0,210153.0,USD,210153.0,
1619,Viral Nation,"Toronto, Ontario, Canada",Active,For Profit,,,,,1.0,2.0,"Advertising, Internet Services, Media and Entertainment, Sales and Marketing","Advertising, Marketing, Social Media",1.0,,2022-04-12,250000000.0,CAD,197854466.0,Venture - Series Unknown,Venture - Series Unknown,250000000.0,CAD,197854466.0,250000000.0,CAD,197854466.0,,67.451,"41,313.5",71.0,1045516.0,USD,1045516.0,"Eldridge, Maverix Private Equity"
1620,HTC,"Taoyüan, T'ai-wan, Taiwan",Active,For Profit,32.0,11.0,3.0,6.0,,,"Consumer Electronics, Hardware, Mobile, Software","Consumer Electronics, Hardware, Mobile, Software",,IPO,,,,,,,,,,,,,9.0,"1,399,556","2,607,681.5",385.0,,,,
1621,PolySign,"Oakland, California, United States",Active,For Profit,,,,,1.0,9.0,"Financial Services, Payments, Privacy and Security, Software","Asset Management, Cryptocurrency, FinTech, Payments, Security",6.0,Late Stage Venture,2022-04-13,,,,Series C,Series C,,,,80181196.0,USD,80181196.0,,5.956,"8,744.33",600.0,103497.0,USD,103497.0,"Cowen Digital, GSR Ventures, Cowen Group, Brevan Howard Asset Management, Soros Fund Management"
1622,ANSYS,"Canonsburg, Pennsylvania, United States",Active,For Profit,,,,,,1.0,"Information Technology, Software","Enterprise Software, Information Services, Information Technology, Software",2.0,IPO,2020-12-09,206770400.0,USD,206770400.0,Post-IPO Equity,Post-IPO Equity,206770400.0,USD,206770400.0,206770400.0,USD,206770400.0,30.0,"2,913,750","1,784,260.67",856.0,242209019.0,USD,242209019.0,Western Technology Investment
1623,Wagestream,"London, England, United Kingdom",Active,For Profit,1.0,,,,6.0,15.0,"Apps, Financial Services, Software","Apps, Financial Services, FinTech, Wealth Management",7.0,Late Stage Venture,2022-04-13,115000000.0,USD,115000000.0,Debt Financing,Series C,60000000.0,USD,60000000.0,254323381.0,USD,254323381.0,,33.731,"19,865.67",122.0,,,,"Smash Capital, Ascension, BlackRock, QED Investors, Northzone"
1624,Wintermute Trading,"London, England, United Kingdom",Active,For Profit,30.0,2.0,,,2.0,11.0,"Financial Services, Other, Payments, Software","Blockchain, Cryptocurrency, Financial Services",4.0,Early Stage Venture,2021-01-20,20000000.0,USD,20000000.0,Series B,Series B,20000000.0,USD,20000000.0,23800000.0,USD,23800000.0,,,,,,,,"Lightspeed Venture Partners, Hack VC, Kenetic, Pantera Capital, FBG Capital"
1625,OMERS Ventures,"Toronto, Ontario, Canada",Active,,125.0,69.0,7.0,15.0,,,"Financial Services, Lending and Investments",Venture Capital,,,,,,,,,,,,,,,,6.899,"4,927.5",0.0,,,,
1626,Disrupt Ventures,,Active,For Profit,10.0,,1.0,1.0,,,,,,,,,,,,,,,,,,,,,,,,,,
1627,Fuel Venture Capital,"Miami, Florida, United States",Active,,21.0,12.0,9.0,,,,"Financial Services, Lending and Investments",Venture Capital,,,,,,,,,,,,,,,,,,,,,,
1628,Canvas Ventures,"Portola Valley, California, United States",Active,,80.0,40.0,21.0,9.0,,,"Financial Services, Lending and Investments","Finance, Financial Services, Venture Capital",,,,,,,,,,,,,,,1.0,8.416,"5,113.5",59.0,,,,
1629,Hannover Re,"Hanover, Niedersachsen, Germany",Active,For Profit,9.0,2.0,1.0,,,,Financial Services,"Financial Services, Health Insurance, Insurance",,IPO,,,,,,,,,,,,,2.0,151.99,"31,089.83",475.0,,,,
1630,Turntide Technologies,"Sunnyvale, California, United States",Active,For Profit,4.0,,,,7.0,16.0,"Energy, Manufacturing, Science and Engineering, Sustainability","CleanTech, Energy, Energy Efficiency, GreenTech, Industrial Automation",11.0,,2021-06-30,225000000.0,USD,225000000.0,Convertible Note,Venture - Series Unknown,80000000.0,USD,80000000.0,433089623.0,USD,433089623.0,1.0,12.072,"15,712.83",204.0,,,,"National Science Foundation, Fifth Wall, FootPrint Coalition, Breakthrough Energy Ventures, BMW i Ventures"
1631,League,"Toronto, Ontario, Canada",Active,For Profit,,,,,4.0,19.0,"Health Care, Information Technology","Health Care, Information Services, Medical",5.0,Late Stage Venture,2021-12-31,95000000.0,USD,95000000.0,Series C,Series C,95000000.0,USD,95000000.0,171139506.0,USD,171139506.0,3.0,97.303,"64,939.17",216.0,,,,"Manulife Financial, OMERS Ventures, RBC Capital, Foundation Capital, Real Ventures"
1632,Fireside Ventures,"Bengaluru, Karnataka, India",Active,,64.0,39.0,1.0,3.0,,,,,,,,,,,,,,,,,,,,4.441,"3,580.83",692.0,,,,
1633,tabby,"Dubai, Dubai, United Arab Emirates",Active,For Profit,,,,,7.0,19.0,"Financial Services, Payments, Software","Billing, Financial Services, Payments",7.0,Early Stage Venture,2022-03-03,54000000.0,USD,54000000.0,Series B,Series B,54000000.0,USD,54000000.0,186000000.0,USD,186000000.0,,486.241,"184,693.67",406.0,,,,"Delivery Hero, Mubadala, VentureSouq, Global Founders Capital, HOF Capital"
1634,Tive,"Boston, Massachusetts, United States",Active,For Profit,,,,,5.0,18.0,"Internet Services, Software, Transportation","Enterprise Software, Internet of Things, Shipping, Software, Supply Chain Management",7.0,Early Stage Venture,2022-04-11,54000000.0,USD,54000000.0,Series B,Series B,54000000.0,USD,54000000.0,81929989.0,USD,81929989.0,6.0,81.729,"6,325.33",2.608,,,,"Techstars, Fifth Wall, RRE Ventures, Qualcomm Ventures, AXA Venture Partners"
1635,Celona,"Cupertino, California, United States",Active,For Profit,,,,,6.0,6.0,"Hardware, Internet Services, Mobile","Internet, Mobile, Wireless",3.0,Late Stage Venture,2022-03-28,60000000.0,USD,60000000.0,Series C,Series C,60000000.0,USD,60000000.0,100000000.0,USD,100000000.0,1.0,28.323,"55,464.67",498.0,,,,"Norwest Venture Partners, Qualcomm Ventures, Lightspeed Venture Partners, Cervin, NTT Venture Capital"
1636,Baillie Gifford,"Edinburgh, Edinburgh, City of, United Kingdom",Active,,147.0,43.0,11.0,38.0,,,Financial Services,"Asset Management, Finance, Financial Services",1.0,,2021-02-24,,,,Secondary Market,,,,,,,,,158.11,"135,926.5",213.0,,,,
1637,Real Ventures,"Montréal, Quebec, Canada",Active,,280.0,49.0,6.0,35.0,,2.0,"Financial Services, Lending and Investments","Angel Investment, Finance, Venture Capital",3.0,,2019-03-18,,,,Venture - Series Unknown,Venture - Series Unknown,,,,,,,2.0,5.331,"3,570.83",15.0,194974.0,USD,194974.0,"Caisse de Depot et Placement du Quebec, Acta Wireless"
1638,Embark,"Boston, Massachusetts, United States",Active,For Profit,,,,,5.0,14.0,"Community and Lifestyle, Health Care","Health Care, Pet, Veterinary",5.0,Early Stage Venture,2021-07-26,75000000.0,USD,75000000.0,Series B,Series B,75000000.0,USD,75000000.0,94300000.0,USD,94300000.0,,"1,903,473","1,152,360.17",813.0,185377.0,USD,185377.0,"Slow Ventures, SoftBank Vision Fund, F-Prime Capital, Founder Collective, Section 32"
1639,MediBuddy,"Bangalore, Karnataka, India",Active,For Profit,,,,,6.0,15.0,"Financial Services, Health Care, Mobile","Health Care, Health Insurance, Medical, mHealth",6.0,M&A,2022-02-21,125000000.0,USD,125000000.0,Series C,Series C,125000000.0,USD,125000000.0,192132379.0,USD,192132379.0,,"3,128,250","3,202,700.5",739.0,,,,"Bessemer Venture Partners, Lightrock, Alteria Capital, InnoVen Capital, Rebright Partners"
1640,Ascent Capital,"Bangalore, Karnataka, India",Active,For Profit,38.0,20.0,,7.0,,,"Financial Services, Lending and Investments",Venture Capital,,,,,,,,,,,,,,,,,,,,,,
1641,Lux Capital,"New York, New York, United States",Active,,393.0,97.0,98.0,46.0,,,"Financial Services, Lending and Investments","Finance, Financial Services, Venture Capital",,,,,,,,,,,,,,,1.0,22.345,"16,482.33",460.0,364834.0,USD,364834.0,
1642,PagerDuty,"San Francisco, California, United States",Active,For Profit,1.0,,1.0,,7.0,16.0,"Information Technology, Internet Services, Software","Cloud Computing, Information Technology, IT Management, SaaS, Software",7.0,IPO,2018-09-06,90000000.0,USD,90000000.0,Series D,Series D,90000000.0,USD,90000000.0,173600000.0,USD,173600000.0,52.0,"3,405,897","3,507,880.33",1.124,30765052.0,USD,30765052.0,"Andreessen Horowitz, Y Combinator, T. Rowe Price, Accel, Bessemer Venture Partners"
1643,Sierra Oncology,"San Mateo, California, United States",Active,For Profit,,,,,3.0,12.0,"Biotechnology, Health Care, Science and Engineering","Biotechnology, Health Care, Life Science, Therapeutics",13.0,M&A,2022-01-31,135000000.0,USD,135000000.0,Post-IPO Equity,Post-IPO Equity,135000000.0,USD,135000000.0,494131452.0,USD,494131452.0,,5.757,"7,222.17",1.229,,,,"RA Capital Management, OrbiMed, Vivo Capital, Frazier Healthcare Partners, Capital Midwest Fund"
1644,Lightbox,"Los Angeles, California, United States",Active,For Profit,,,,,1.0,1.0,Commerce and Shopping,Retail,1.0,Seed,2021-07-18,120000.0,USD,120000.0,Pre-Seed,Pre-Seed,120000.0,USD,120000.0,120000.0,USD,120000.0,,,,,,,,Techstars Los Angeles Accelerator
1645,unico IDtech,"São Paulo, Sao Paulo, Brazil",Active,For Profit,,,,,4.0,6.0,"Information Technology, Privacy and Security, Professional Services, Software","Consulting, Identity Management, Information Technology, Software",4.0,Late Stage Venture,2022-04-14,100000000.0,USD,100000000.0,Series D,Series D,100000000.0,USD,100000000.0,336857766.0,USD,336857766.0,,118.026,"38,648.5",176.0,,,,"General Atlantic, SOFTBANK Latin America Ventures, big_bets, GS Growth, Igah Ventures."
1646,Rethink Education,"White Plains, New York, United States",Active,,119.0,41.0,52.0,18.0,,,"Education, Financial Services, Lending and Investments, Software","EdTech, Enterprise Software, Venture Capital",,,,,,,,,,,,,,,,8.332,"4,608.33",459.0,,,,
1647,SkyHive,"Vancouver, British Columbia, Canada",Active,For Profit,,,,,4.0,8.0,"Administrative Services, Artificial Intelligence, Data and Analytics, Science and Engineering, Software","Analytics, Artificial Intelligence, Enterprise Software, Human Resources, SaaS",6.0,,2022-04-11,,,,Venture - Series Unknown,Venture - Series Unknown,,,,48000000.0,USD,48000000.0,5.0,7.014,,980.0,,,,"Accenture, Deutsche Bank, Village Capital, Accenture Ventures, Eldridge"
1648,IUNU,"Seattle, Washington, United States",Active,For Profit,,,,,4.0,12.0,"Agriculture and Farming, Artificial Intelligence, Consumer Electronics, Data and Analytics, Energy, Hardware, Manufacturing, Science and Engineering, Software, Sustainability","Agriculture, Artificial Intelligence, Computer, Industrial, Renewable Energy",8.0,Early Stage Venture,2022-03-16,24000000.0,USD,24000000.0,Series B,Series B,24000000.0,USD,24000000.0,45706954.0,USD,45706954.0,,5.803,"2,613.67",29.0,,,,"Liquid 2 Ventures, Village Capital, Initialized Capital, S2G Ventures, Astanor Ventures"
1649,Dapper Labs,"Vancouver, British Columbia, Canada",Active,For Profit,42.0,6.0,2.0,,6.0,97.0,"Gaming, Other, Software","Blockchain, Gaming, Software",9.0,Late Stage Venture,2021-09-21,250000000.0,USD,250000000.0,Series D,Series D,250000000.0,USD,250000000.0,607450000.0,USD,607450000.0,,134.141,176.165,218.0,,,,"Snow K., Animoca Brands, Digital Currency Group, Andreessen Horowitz, BlockTower Capital"
1650,Voodoo,"Paris, Ile-de-France, France",Active,For Profit,5.0,4.0,,,4.0,8.0,"Apps, Gaming, Mobile, Software","Casual Games, Mobile Apps, Online Games",6.0,,2021-08-02,266000000.0,EUR,315851844.0,Corporate Round,Corporate Round,266000000.0,EUR,315851844.0,516851844.0,USD,516851844.0,,"3,422,258",864.381,926.0,,,,"Tencent, Goldman Sachs, Tikehau Capital, SAIF Partners, GS Growth"
1651,CaptivateIQ,"San Francisco, California, United States",Active,For Profit,,,,,5.0,16.0,"Data and Analytics, Information Technology, Sales and Marketing, Software","Data Integration, Management Information Systems, SaaS, Sales, Software",5.0,Late Stage Venture,2022-01-26,100000000.0,USD,100000000.0,Series C,Series C,100000000.0,USD,100000000.0,164600000.0,USD,164600000.0,1.0,73.728,47.825,176.0,495333.0,USD,495333.0,"Sequoia Capital, Y Combinator, Accel, Bessemer Venture Partners, Elad Gil"
1652,Evisort,"San Mateo, California, United States",Active,For Profit,,,,,5.0,8.0,"Artificial Intelligence, Data and Analytics, Information Technology, Professional Services, Science and Engineering, Software","Analytics, Artificial Intelligence, Document Management, Legal Tech, Machine Learning, Software",4.0,Early Stage Venture,2021-02-23,35000000.0,USD,35000000.0,Series B,Series B,35000000.0,USD,35000000.0,55600000.0,USD,55600000.0,1.0,15.078,"19,366.83",197.0,,,,"Vertex Ventures, General Atlantic, Village Global, Rough Draft Ventures, M12 - Microsoft's Venture Fund"
1653,Cowen Group,"New York, New York, United States",Active,For Profit,38.0,12.0,3.0,26.0,,,Financial Services,Financial Services,1.0,IPO,2019-05-01,53000000.0,USD,53000000.0,Post-IPO Debt,,,,,53000000.0,USD,53000000.0,2.0,128.456,78.47,378.0,,,,
1654,Alkeon Capital,"New York, New York, United States",Active,For Profit,50.0,20.0,4.0,3.0,,,"Financial Services, Professional Services","Business Development, Consulting, Finance, Financial Services",,,,,,,,,,,,,,,,,,,,,,
1655,S2G Ventures,"Chicago, Illinois, United States",Active,For Profit,116.0,41.0,30.0,5.0,,,"Agriculture and Farming, Financial Services, Food and Beverage, Lending and Investments","Agriculture, Financial Services, Food and Beverage, Venture Capital",,,,,,,,,,,,,,,,4.997,"9,236.83",118.0,,,,
1656,NET1 UEPS Technologies Inc.,"Johannesburg, NA - South Africa, South Africa",Active,For Profit,5.0,3.0,,1.0,1.0,2.0,Financial Services,Financial Services,3.0,IPO,2020-04-28,580000000.0,ZAR,31175789.0,Post-IPO Equity,Post-IPO Equity,580000000.0,ZAR,31175789.0,31175790.0,USD,31175790.0,,1.041,"4,965.5",40.0,,,,"General Atlantic, Value Capital Partners"
1657,Qatar Investment Authority,"Doha, Ad Dawhah, Qatar",Active,,59.0,25.0,5.0,19.0,,,"Financial Services, Government and Military, Lending and Investments","Asset Management, Banking, Finance, Financial Services, Government",,,,,,,,,,,,,,,,12.918,"8,993.33",75.0,,,,
1658,Komodo Health,"San Francisco, California, United States",Active,For Profit,,,,,2.0,10.0,"Artificial Intelligence, Data and Analytics, Health Care, Information Technology, Software","Health Care, Information Technology, Predictive Analytics, Software",6.0,Late Stage Venture,2021-03-22,220000000.0,USD,220000000.0,Series E,Series E,220000000.0,USD,220000000.0,314000000.0,USD,314000000.0,1.0,27.692,22.219,322.0,1667546.0,USD,1667546.0,"Andreessen Horowitz, Tiger Global Management, Oak HC/FT, Casdin Capital, SVB Capital"
1659,Partake Foods,"Jersey City, New Jersey, United States",Active,For Profit,,,,,4.0,15.0,"Community and Lifestyle, Food and Beverage, Health Care","Food and Beverage, Health Care, Lifestyle, Wellness",8.0,,2022-04-15,2898900.0,USD,2898900.0,Venture - Series Unknown,Venture - Series Unknown,2898900.0,USD,2898900.0,9772407.0,USD,9772407.0,,129.741,113.272,631.0,5926.0,USD,5926.0,"SoFi, Marcy Venture Partners, CircleUp, Backstage Capital, Shawn Carter"
1660,Hearst Ventures,"New York, New York, United States",Active,,156.0,25.0,17.0,42.0,,,"Financial Services, Information Technology, Lending and Investments, Media and Entertainment, Software","Information Services, Media and Entertainment, Software, Venture Capital",,,,,,,,,,,,,,,,176.655,65.57,233.0,,,,
1661,MongoDB,"New York, New York, United States",Active,For Profit,,,,,9.0,17.0,"Data and Analytics, Internet Services, Software","Cloud Computing, Database, Open Source, SaaS, Software",12.0,IPO,2018-03-06,,,,Post-IPO Equity,Post-IPO Equity,,,,311000000.0,USD,311000000.0,62.0,"11,579,318","9,487,584",743.0,85050625.0,USD,85050625.0,"Sequoia Capital, Goldman Sachs, Union Square Ventures, Fidelity, T. Rowe Price"
